{"grao":"1 linha por subconjunto × departamento (≥10% do faturamento) × par de subcategorias (top 20)","dimensoes":{"subconjunto":["todos","Fiéis","Regulares","Fiéis+Regulares","Esporádicos","Fiéis+Esporádicos","Regulares+Esporádicos","Fiéis+Regulares+Esporádicos","Em pausa","Fiéis+Em pausa","Regulares+Em pausa","Fiéis+Regulares+Em pausa","Esporádicos+Em pausa","Fiéis+Esporádicos+Em pausa","Regulares+Esporádicos+Em pausa","Fiéis+Regulares+Esporádicos+Em pausa"],"departamento":["GROCERY","DRUG GM"],"subcategoria_a":["CAT FOOD","LAUNDRY ADDITIVES","BLEACH","DOG FOODS","DRY NOODLES/PASTA","AIR CARE","BAKING NEEDS","FLOUR & MEALS","HOUSEHOLD CLEANG NEEDS","BEANS - CANNED GLASS & MW","FROZEN BREAD/DOUGH","DISHWASH DETERGENTS","FRZN BREAKFAST FOODS","BATH TISSUES","BABY HBC","HAIR CARE PRODUCTS","DEODORANTS","ORAL HYGIENE PRODUCTS","CANDY - PACKAGED","CANDY - CHECKLANE","DRY MIX DESSERTS","PWDR/CRYSTL DRNK MX","FACIAL TISS/DNR NAPKIN","MOLASSES/SYRUP/PANCAKE MIXS","HOME HEALTH CARE","COOKWARE & BAKEWARE","ETHNIC PERSONAL CARE","FILM AND CAMERA PRODUCTS","HAIR CARE ACCESSORIES","DOMESTIC GOODS","FEMININE HYGIENE","IN-STORE PHOTOFINISHING","APPAREL","HOSIERY/SOCKS","COFFEE FILTERS","DRY SAUCES/GRAVY","DINNER MXS:DRY","BAKING MIXES","DRY BN/VEG/POTATO/RICE","FRUIT - SHELF STABLE","FROZEN PIZZA","CONDIMENTS/SAUCES","GLASSES/VISION AIDS","HALLOWEEN","GLASSWARE & DINNERWARE","PERSONAL CARE APPLIANCES","CONTINUITIES","DOLLAR VALUE PRODUCTS","HARDWARE SUPPLIES","FD WRAPS/BAGS/TRSH BG","FAMILY PLANNING","CIGARS","BOTTLE DEPOSITS","CAT LITTER","FRZN FRUITS","FROZEN PIE/DESSERTS","LIQUOR","DOMESTIC WINE","IMPORTED WINE","FROZEN CHICKEN","IRONING AND CHEMICALS","FOOT CARE PRODUCTS","AUDIO/VIDEO PRODUCTS","ANALGESICS","CANDLES/ACCESSORIES","FALL AND WINTER SEASONAL","BOOKSTORE","EYE AND EAR CARE PRODUCTS","FIRST AID PRODUCTS","MISCELLANEOUS HBC","KITCHEN GADGETS","DISPOSIBLE FOILWARE","COLD AND FLU","FRZN JCE CONC/DRNKS","CANNED MILK","FRZN ICE","BEERS/ALES","MISC. DAIRY","FRZN POTATOES","PET CARE SUPPLIES","TOYS AND GAMES","PLASTIC HOUSEWARES","BABY FOODS","INSECTICIDES","AUTOMOTIVE PRODUCTS","ELECTRICAL SUPPPLIES","ANTACIDS","BROOMS AND MOPS","BAKED BREAD/BUNS/ROLLS","CHEESE","FLUID MILK PRODUCTS"],"subcategoria_b":["CAT LITTER","LAUNDRY DETERGENTS","LAUNDRY ADDITIVES","PET CARE SUPPLIES","PASTA SAUCE","HOUSEHOLD CLEANG NEEDS","CANNED MILK","SHORTENING/OIL","SUGARS/SWEETNERS","DRY SAUCES/GRAVY","MOLASSES/SYRUP/PANCAKE MIXS","FLOUR & MEALS","PAPER TOWELS","DIAPERS & DISPOSABLES","SOAP - LIQUID & BAR","ORAL HYGIENE PRODUCTS","HAIR CARE PRODUCTS","CHRISTMAS  SEASONAL","STATIONERY & SCHOOL SUPPLIES","GREETING CARDS/WRAP/PARTY SPLY","MAGAZINE","CANDY - PACKAGED","COLD AND FLU","CIGARETTES","FROZEN PIE/DESSERTS","VEGETABLES - SHELF STABLE","PAPER HOUSEWARES","PNT BTR/JELLY/JAMS","SINUS AND ALLERGY","FD WRAPS/BAGS/TRSH BG","SUNTAN","NATURAL HBC","MISCELLANEOUS HBC","HOME HEALTH CARE","OVERNIGHT PHOTOFINISHING","SPORTS MEMORABLILIA","MEAT - SHELF STABLE","BAKING NEEDS","DRY BN/VEG/POTATO/RICE","FRUIT - SHELF STABLE","DRY NOODLES/PASTA","FRZN POTATOES","SALD DRSNG/SNDWCH SPRD","HISPANIC","PERSONAL CARE APPLIANCES","WATCHES/CALCULATORS/LOBBY","PORTABLE ELECTRIC APPLIANCES","SEWING","DOLLAR VALUE PRODUCTS","DOMESTIC GOODS","LONG DISTANCE CALLING CARDS","HOSIERY/SOCKS","EASTER","PLASTIC HOUSEWARES","GLASSWARE & DINNERWARE","LAXATIVES","INSECTICIDES","TEAS","FRZN JCE CONC/DRNKS","BUTTER","FRZN FRUITS","OLIVES","IMPORTED WINE","MISC WINE","FRZN BREAKFAST FOODS","SEAFOOD - SHELF STABLE","SYRUPS/TOPPINGS","DISHWASH DETERGENTS","FROZEN CHICKEN","J-HOOKS","HAIR CARE ACCESSORIES","FALL AND WINTER SEASONAL","FEMININE HYGIENE","SHOE CARE","FOOT CARE PRODUCTS","INFANT CARE PRODUCTS","VALENTINE","PWDR/CRYSTL DRNK MX","ISOTONIC DRINKS","LIQUOR","SHAVING CARE PRODUCTS","VITAMINS","TOYS AND GAMES","KITCHEN GADGETS","PREPAID WIRELESS&ACCESSORIES","HAND/BODY/FACIAL PRODUCTS","HALLOWEEN","SPRING/SUMMER SEASONAL","CHEESE","FLUID MILK PRODUCTS","SOFT DRINKS","SPICES & EXTRACTS"]},"colunas":["subconjunto","departamento","subcategoria_a","subcategoria_b","cestas_par","cestas_a","cestas_b","cestas_total","suporte","confianca_a_b","confianca_b_a","lift","amostra_pequena"],"linhas":[[0,0,0,0,393,1905,926,68947,0.0057,0.2063,0.4244,15.3604,false],[0,0,1,1,496,1255,2325,68947,0.007194,0.3952,0.2133,11.7201,false],[0,0,2,2,202,963,1255,68947,0.00293,0.2098,0.161,11.5238,false],[0,0,2,1,357,963,2325,68947,0.005178,0.3707,0.1535,10.9935,false],[0,0,3,3,236,2162,774,68947,0.003423,0.1092,0.3049,9.7237,false],[0,0,4,4,1875,4171,3433,68947,0.027195,0.4495,0.5462,9.0282,false],[0,0,5,5,317,1179,2097,68947,0.004598,0.2689,0.1512,8.8402,false],[0,0,6,6,258,3409,647,68947,0.003742,0.0757,0.3988,8.065,false],[0,0,7,7,290,999,2488,68947,0.004206,0.2903,0.1166,8.0445,false],[0,0,7,8,353,999,3032,68947,0.00512,0.3534,0.1164,8.0352,false],[0,0,8,2,289,2097,1255,68947,0.004192,0.1378,0.2303,7.5713,false],[0,0,9,9,679,2793,2244,68947,0.009848,0.2431,0.3026,7.4695,false],[0,0,2,5,211,963,2097,68947,0.00306,0.2191,0.1006,7.204,false],[0,0,10,4,718,2154,3433,68947,0.010414,0.3333,0.2091,6.6945,false],[0,0,11,2,217,1781,1255,68947,0.003147,0.1218,0.1729,6.6937,false],[0,0,12,10,285,2105,1398,68947,0.004134,0.1354,0.2039,6.6773,false],[0,0,11,1,398,1781,2325,68947,0.005773,0.2235,0.1712,6.6269,false],[0,0,6,11,324,3409,999,68947,0.004699,0.095,0.3243,6.5595,false],[0,0,13,12,1145,3994,3018,68947,0.016607,0.2867,0.3794,6.5493,false],[0,0,11,5,340,1781,2097,68947,0.004931,0.1909,0.1621,6.2767,false],[0,1,14,13,314,1134,1345,68947,0.004554,0.2769,0.2335,14.1942,false],[0,1,15,14,409,2248,1684,68947,0.005932,0.1819,0.2429,7.449,false],[0,1,16,14,221,1223,1684,68947,0.003205,0.1807,0.1312,7.3984,false],[0,1,16,15,261,1223,2297,68947,0.003786,0.2134,0.1136,6.4057,false],[0,1,16,16,245,1223,2248,68947,0.003553,0.2003,0.109,6.1441,false],[0,1,17,14,319,2297,1684,68947,0.004627,0.1389,0.1894,5.6859,false],[0,1,15,15,347,2248,2297,68947,0.005033,0.1544,0.1511,4.6333,false],[0,1,18,17,243,6513,935,68947,0.003524,0.0373,0.2599,2.7512,false],[0,1,18,18,244,6513,1254,68947,0.003539,0.0375,0.1946,2.0598,false],[0,1,18,19,392,6513,2049,68947,0.005686,0.0602,0.1913,2.0252,false],[0,1,18,15,372,6513,2297,68947,0.005395,0.0571,0.162,1.7144,false],[0,1,18,20,315,6513,1954,68947,0.004569,0.0484,0.1612,1.7066,false],[0,1,18,16,346,6513,2248,68947,0.005018,0.0531,0.1539,1.6293,false],[0,1,18,14,255,6513,1684,68947,0.003698,0.0392,0.1514,1.603,false],[0,1,19,21,885,5868,6513,68947,0.012836,0.1508,0.1359,1.5966,false],[0,1,19,20,245,5868,1954,68947,0.003553,0.0418,0.1254,1.4732,false],[0,1,19,16,240,5868,2248,68947,0.003481,0.0409,0.1068,1.2544,false],[0,1,18,22,212,6513,1878,68947,0.003075,0.0326,0.1129,1.195,false],[0,1,19,15,210,5868,2297,68947,0.003046,0.0358,0.0914,1.0742,false],[0,1,19,23,261,5868,2884,68947,0.003786,0.0445,0.0905,1.0633,false],[1,0,0,0,290,1408,669,48002,0.006041,0.206,0.4335,14.7784,false],[1,0,1,1,370,918,1714,48002,0.007708,0.4031,0.2159,11.2878,false],[1,0,2,1,255,674,1714,48002,0.005312,0.3783,0.1488,10.5957,false],[1,0,4,4,1321,2999,2420,48002,0.02752,0.4405,0.5459,8.7372,false],[1,0,5,5,225,825,1550,48002,0.004687,0.2727,0.1452,8.4461,false],[1,0,7,8,244,693,2061,48002,0.005083,0.3521,0.1184,8.2005,false],[1,0,9,9,464,1922,1590,48002,0.009666,0.2414,0.2918,7.2883,false],[1,0,8,2,215,1550,918,48002,0.004479,0.1387,0.2342,7.2531,false],[1,0,10,4,514,1501,2420,48002,0.010708,0.3424,0.2124,6.7924,false],[1,0,6,11,236,2425,693,48002,0.004916,0.0973,0.3405,6.741,false],[1,0,11,1,304,1316,1714,48002,0.006333,0.231,0.1774,6.4694,false],[1,0,20,24,200,1065,1407,48002,0.004166,0.1878,0.1421,6.4069,false],[1,0,13,12,845,2882,2211,48002,0.017603,0.2932,0.3822,6.3655,false],[1,0,11,5,246,1316,1550,48002,0.005125,0.1869,0.1587,5.789,false],[1,0,21,8,219,891,2061,48002,0.004562,0.2458,0.1063,5.7246,false],[1,0,22,12,417,1585,2211,48002,0.008687,0.2631,0.1886,5.7119,false],[1,0,9,25,1142,1922,5044,48002,0.023791,0.5942,0.2264,5.6545,false],[1,0,8,1,310,1550,1714,48002,0.006458,0.2,0.1809,5.6012,false],[1,0,22,26,290,1585,1651,48002,0.006041,0.183,0.1757,5.3196,false],[1,0,23,27,222,967,2091,48002,0.004625,0.2296,0.1062,5.2703,false],[1,1,14,13,241,851,1019,48002,0.005021,0.2832,0.2365,13.3405,false],[1,1,15,14,299,1659,1230,48002,0.006229,0.1802,0.2431,7.0336,false],[1,1,17,14,219,1621,1230,48002,0.004562,0.1351,0.178,5.2725,false],[1,1,15,15,262,1659,1621,48002,0.005458,0.1579,0.1616,4.6766,false],[1,1,18,19,290,4678,1480,48002,0.006041,0.062,0.1959,2.0106,false],[1,1,18,15,271,4678,1621,48002,0.005646,0.0579,0.1672,1.7155,false],[1,1,18,20,228,4678,1407,48002,0.00475,0.0487,0.162,1.6628,false],[1,1,18,16,261,4678,1659,48002,0.005437,0.0558,0.1573,1.6143,false],[1,1,19,21,639,4324,4678,48002,0.013312,0.1478,0.1366,1.5164,false],[1,1,24,28,1,1,354,48002,2.1e-05,1.0,0.0028,135.5989,true],[1,1,25,29,2,245,3,48002,4.2e-05,0.0082,0.6667,130.6177,true],[1,1,26,30,1,53,14,48002,2.1e-05,0.0189,0.0714,64.6927,true],[1,1,27,31,2,151,10,48002,4.2e-05,0.0132,0.2,63.5788,true],[1,1,28,32,2,269,6,48002,4.2e-05,0.0074,0.3333,59.482,true],[1,1,29,30,2,124,14,48002,4.2e-05,0.0161,0.1429,55.3018,true],[1,1,30,33,1,919,1,48002,2.1e-05,0.0011,1.0,52.2329,true],[1,1,31,34,6,143,40,48002,0.000125,0.042,0.15,50.3517,true],[1,1,32,35,5,80,61,48002,0.000104,0.0625,0.082,49.1824,true],[1,1,33,32,1,172,6,48002,2.1e-05,0.0058,0.1667,46.5136,true],[1,1,34,29,1,368,3,48002,2.1e-05,0.0027,0.3333,43.4801,true],[2,0,4,4,498,1035,910,17766,0.028031,0.4812,0.5473,9.3937,false],[2,0,13,12,270,1000,732,17766,0.015198,0.27,0.3689,6.553,false],[2,0,9,25,443,767,1859,17766,0.024935,0.5776,0.2383,5.5197,false],[2,0,35,25,310,569,1859,17766,0.017449,0.5448,0.1668,5.2067,false],[2,0,36,36,352,1100,1134,17766,0.019813,0.32,0.3104,5.0133,false],[2,0,37,37,221,913,862,17766,0.012439,0.2421,0.2564,4.9889,false],[2,0,36,38,311,1100,1031,17766,0.017505,0.2827,0.3016,4.8719,false],[2,0,6,8,202,862,871,17766,0.01137,0.2343,0.2319,4.7799,false]